{
  "$schema": "https://json-schema.org/draft/2020-12/schema",
  "title": "SuiteCapabilityDescriptor",
  "type": "object",
  "additionalProperties": false,
  "required": [
    "id",
    "version",
    "owner_module",
    "kind",
    "purpose",
    "entrypoint",
    "configuration",
    "prerequisites",
    "inputs",
    "outputs",
    "checks",
    "statuses",
    "external_actions"
  ],
  "properties": {
    "id": {
      "type": "string",
      "minLength": 1
    },
    "version": {
      "type": "string",
      "minLength": 1
    },
    "owner_module": {
      "type": "string",
      "minLength": 1
    },
    "purpose": {
      "type": "string",
      "minLength": 1
    },
    "entrypoint": {
      "type": "string",
      "minLength": 1
    },
    "configuration": {
      "type": "string",
      "minLength": 1
    },
    "kind": {
      "type": "string",
      "enum": [
        "adapter",
        "webmodule",
        "build-tool"
      ]
    },
    "prerequisites": {
      "type": "array",
      "items": {
        "type": "string",
        "minLength": 1
      },
      "uniqueItems": true
    },
    "inputs": {
      "type": "array",
      "items": {
        "type": "string",
        "minLength": 1
      },
      "uniqueItems": true
    },
    "outputs": {
      "type": "array",
      "items": {
        "type": "string",
        "minLength": 1
      },
      "uniqueItems": true
    },
    "checks": {
      "type": "array",
      "items": {
        "type": "string",
        "minLength": 1
      },
      "uniqueItems": true
    },
    "statuses": {
      "type": "array",
      "items": {
        "type": "string",
        "minLength": 1
      },
      "uniqueItems": true
    },
    "external_actions": {
      "type": "array",
      "items": {
        "type": "string",
        "minLength": 1,
        "enum": [
          "publish",
          "send",
          "spend",
          "print",
          "delete",
          "modify_external"
        ]
      },
      "uniqueItems": true
    }
  }
}
